{
  "$schema": "https://json-schema.org/draft/2020-12/schema",
  "$id": "https://github.com/yjw17694927050-art/CAN-X/.agent/schemas/task.schema.json",
  "title": "CAN-X agent task contract",
  "description": "One unit of delegated work with a bounded, machine-checkable ownership surface. This file is the interchange contract; tools/agent/contracts.py is the enforcement. A test asserts the two required-field lists never drift.",
  "type": "object",
  "additionalProperties": false,
  "required": [
    "schema_version",
    "task_id",
    "title",
    "objective",
    "scope",
    "non_goals",
    "base_sha",
    "owner",
    "allowed_paths",
    "forbidden_paths",
    "dependencies",
    "shared_contracts",
    "acceptance_criteria",
    "required_tests",
    "handoff_requirements",
    "risk_class",
    "status",
    "revision"
  ],
  "properties": {
    "schema_version": {
      "const": 1,
      "description": "Contract version. Bumped only for a breaking change."
    },
    "task_id": {
      "type": "string",
      "pattern": "^[A-Za-z0-9](?:[A-Za-z0-9._-]{0,62}[A-Za-z0-9])?$",
      "description": "Deterministic, bounded, human-readable id, e.g. AGENT-02-B."
    },
    "title": { "type": "string", "minLength": 1 },
    "objective": {
      "type": "string",
      "minLength": 1,
      "description": "What must be true when the task is done. Frozen once work starts."
    },
    "scope": { "type": "string", "minLength": 1 },
    "non_goals": {
      "type": "array",
      "items": { "type": "string", "minLength": 1 },
      "description": "Explicitly out of scope for this task."
    },
    "base_sha": {
      "type": "string",
      "pattern": "^[0-9a-f]{40}$",
      "description": "The integration commit the task branched from. Full 40 hex only."
    },
    "branch": {
      "type": ["string", "null"],
      "minLength": 1,
      "description": "Sub-agent branches must be <branch_prefix><task_id>-<slug>. Required for execution_mode=isolated-worktree; must be absent (null) for native-shared, where the Harness executes in the Main Agent's worktree."
    },
    "worktree": {
      "type": ["string", "null"],
      "minLength": 1,
      "description": "Repository-relative worktree path; must live under worktrees_dir. Required for execution_mode=isolated-worktree; must be absent (null) for native-shared."
    },
    "execution_mode": {
      "enum": ["isolated-worktree", "native-shared"],
      "default": "isolated-worktree",
      "description": "How the worker executes. isolated-worktree = the AGENT-01 model: the Sub-Agent owns a branch and a registered worktree. native-shared = the host Harness's default: the worker executes inside the Main Agent's single worktree, so the contract declares neither and the delivery is the real commit range base_sha..head_sha on the integration branch. The mode changes where the delivery lives, never who may touch what (ADR-0003)."
    },
    "integration_paths": {
      "type": "array",
      "items": { "type": "string", "minLength": 1 },
      "default": [],
      "description": "native-shared only. Main-Agent-owned paths that may legitimately sit inside this task's delivery commit range (a cross-boundary integration test, for example). Empty for an isolated task. May never reach a protected, public-truth or safety path, nor overlap the task's own forbidden_paths, and it participates in conflict classification like allowed_paths."
    },
    "owner": {
      "type": "string",
      "pattern": "^[A-Za-z0-9][A-Za-z0-9._-]{0,31}$",
      "description": "Agent identity: main, sub-a, sub-b, sub-c, sub-d."
    },
    "allowed_paths": {
      "type": "array",
      "minItems": 1,
      "items": { "type": "string", "minLength": 1 },
      "description": "Ownership surface. Anything not listed here is not editable. Globs: *, **, ?."
    },
    "forbidden_paths": {
      "type": "array",
      "items": { "type": "string", "minLength": 1 },
      "description": "Explicit exclusions inside the allowed surface; they win over allowed_paths."
    },
    "dependencies": {
      "type": "array",
      "items": { "type": "string", "minLength": 1 },
      "description": "Task ids that must be DONE before this task is READY."
    },
    "shared_contracts": {
      "type": "array",
      "items": {
        "type": "object",
        "additionalProperties": false,
        "required": ["path"],
        "properties": {
          "path": { "type": "string", "minLength": 1 },
          "sha": { "type": ["string", "null"], "pattern": "^[0-9a-f]{40}$" }
        }
      },
      "description": "The shared contracts this task is built against, and the revision it was built against."
    },
    "acceptance_criteria": {
      "type": "array",
      "minItems": 1,
      "items": { "type": "string", "minLength": 1 }
    },
    "required_tests": {
      "type": "array",
      "minItems": 1,
      "items": { "type": "string", "minLength": 1 },
      "description": "Test names a handoff must report for the task to be integration-ready."
    },
    "handoff_requirements": {
      "type": "array",
      "minItems": 1,
      "items": { "type": "string", "minLength": 1 }
    },
    "risk_class": {
      "enum": ["LOW", "MEDIUM", "HIGH", "SAFETY_CRITICAL"],
      "description": "Development risk label. Never to be confused with the Runtime RiskLevel."
    },
    "status": {
      "enum": [
        "PLANNED",
        "READY",
        "IN_PROGRESS",
        "HANDOFF_READY",
        "BLOCKED",
        "INTEGRATING",
        "DONE",
        "FAILED",
        "CANCELLED"
      ]
    },
    "revision": {
      "type": "integer",
      "minimum": 1,
      "description": "Bumped when a frozen field changes; a silent change is refused."
    }
  }
}
